{
  "run_id": "run-1777971225",
  "selected_sources": [
    {
      "source_id": "cvpr2026-37067",
      "title": "Point4Cast: Streaming Dynamic Scene Reconstruction and Forecasting",
      "url_or_path": "https://cvpr.thecvf.com/virtual/2026/poster/37067",
      "source_type": "paper",
      "venue_or_publisher": "CVPR 2026 Accept (Highlight)",
      "date": "2026",
      "discovery_method": "browser_rendered_dom+official_json",
      "official_confirmation_url": "https://cvpr.thecvf.com/static/virtual/data/cvpr-2026-orals-posters.json",
      "rank": 1,
      "selection_rationale": "Highest exact-match relevance: official CVPR 2026 highlight explicitly targets streaming 2D video input, online updates, dynamic 3D reconstruction, forecasting, point maps, camera parameters, and scene flow.",
      "expected_use": "Primary source for the scoped question's core formulation: streaming video-to-3D point-map reconstruction and forecasting."
    },
    {
      "source_id": "iclr2026-RTTYGeC2Io",
      "title": "STream3R: Scalable Sequential 3D Reconstruction with Causal Transformer",
      "url_or_path": "https://openreview.net/forum?id=RTTYGeC2Io",
      "pdf_url": "https://openreview.net/pdf?id=RTTYGeC2Io",
      "source_type": "paper",
      "venue_or_publisher": "ICLR 2026 Poster",
      "date": "2026",
      "discovery_method": "official_openreview_api",
      "official_confirmation_url": "https://openreview.net/forum?id=RTTYGeC2Io",
      "rank": 2,
      "selection_rationale": "Official ICLR 2026 accepted record with direct relevance to pointmap prediction, sequential/streaming image processing, causal attention, online 3D perception, and real-time streaming environments.",
      "expected_use": "Primary source for causal-transformer streaming pointmap reconstruction and scalability claims."
    },
    {
      "source_id": "cvpr2026-36688",
      "title": "LASER: Layer-wise Scale Alignment for Training-Free Streaming 4D Reconstruction",
      "url_or_path": "https://cvpr.thecvf.com/virtual/2026/poster/36688",
      "source_type": "paper",
      "venue_or_publisher": "CVPR 2026 Accept (Poster)",
      "date": "2026",
      "discovery_method": "browser_rendered_dom+official_json",
      "official_confirmation_url": "https://cvpr.thecvf.com/static/virtual/data/cvpr-2026-orals-posters.json",
      "rank": 3,
      "selection_rationale": "Official CVPR 2026 record explicitly addresses streaming videos, point map reconstruction, memory limits, FPS, and training-free conversion of offline reconstruction models into streaming systems.",
      "expected_use": "Primary source for practical streaming conversion, scale alignment, runtime, and memory tradeoffs."
    },
    {
      "source_id": "iclr2026-SaiDRQU7Ez",
      "title": "StreamSplat: Towards Online Dynamic 3D Reconstruction from Uncalibrated Video Streams",
      "url_or_path": "https://openreview.net/forum?id=SaiDRQU7Ez",
      "pdf_url": "https://openreview.net/pdf?id=SaiDRQU7Ez",
      "source_type": "paper",
      "venue_or_publisher": "ICLR 2026 Poster",
      "date": "2026",
      "discovery_method": "official_openreview_api",
      "official_confirmation_url": "https://openreview.net/forum?id=SaiDRQU7Ez",
      "rank": 4,
      "selection_rationale": "Official ICLR 2026 accepted record focused on online dynamic 3D reconstruction from uncalibrated arbitrary-length video streams under latency and memory constraints.",
      "expected_use": "Primary source for online feed-forward 3D Gaussian Splatting from video streams and comparison against optimization-heavy reconstruction."
    },
    {
      "source_id": "cvpr2026-39439",
      "title": "V-DPM: Video Reconstruction with Dynamic Point Maps",
      "url_or_path": "https://cvpr.thecvf.com/virtual/2026/poster/39439",
      "source_type": "paper",
      "venue_or_publisher": "CVPR 2026 Accept (Poster)",
      "date": "2026",
      "discovery_method": "browser_rendered_dom+official_json",
      "official_confirmation_url": "https://cvpr.thecvf.com/static/virtual/data/cvpr-2026-orals-posters.json",
      "rank": 5,
      "selection_rationale": "Official CVPR 2026 record directly targets video reconstruction using dynamic point maps, extending point-map representations from image pairs to videos and dynamic 3D/4D content.",
      "expected_use": "Primary source for the dynamic point map representation and its role in video reconstruction."
    },
    {
      "source_id": "cvpr2026-38602",
      "title": "DynamicVGGT: Learning Dynamic Point Maps for 4D Scene Reconstruction in Autonomous Driving",
      "url_or_path": "https://cvpr.thecvf.com/virtual/2026/poster/38602",
      "source_type": "paper",
      "venue_or_publisher": "CVPR 2026 Accept (Poster)",
      "date": "2026",
      "discovery_method": "browser_rendered_dom+official_json",
      "official_confirmation_url": "https://cvpr.thecvf.com/static/virtual/data/cvpr-2026-orals-posters.json",
      "rank": 6,
      "selection_rationale": "Official CVPR 2026 record on dynamic point maps and temporal correspondence for feed-forward 4D reconstruction, with future point-map prediction in autonomous driving scenes.",
      "expected_use": "Source for dynamic point-map learning, temporal coherence mechanisms, and driving-scene benchmarks."
    },
    {
      "source_id": "cvpr2026-37759",
      "title": "Ov3R: Open-Vocabulary Semantic 3D Reconstruction from RGB Videos",
      "url_or_path": "https://cvpr.thecvf.com/virtual/2026/poster/37759",
      "source_type": "paper",
      "venue_or_publisher": "CVPR 2026 Accept (Highlight)",
      "date": "2026",
      "discovery_method": "browser_rendered_dom+official_json",
      "official_confirmation_url": "https://cvpr.thecvf.com/static/virtual/data/cvpr-2026-orals-posters.json",
      "rank": 7,
      "selection_rationale": "Official CVPR 2026 highlight relevant to RGB video streams and dense point-map prediction, adding semantic reconstruction coverage beyond geometry-only methods.",
      "expected_use": "Source for semantic extensions of video-stream point-map reconstruction and Spatial AI framing."
    },
    {
      "source_id": "cvpr2026-39409",
      "title": "MoRe: Motion-aware Feed-forward 4D Reconstruction Transrformer",
      "url_or_path": "https://cvpr.thecvf.com/virtual/2026/poster/39409",
      "source_type": "paper",
      "venue_or_publisher": "CVPR 2026 Accept (Highlight)",
      "date": "2026",
      "discovery_method": "browser_rendered_dom+official_json",
      "official_confirmation_url": "https://cvpr.thecvf.com/static/virtual/data/cvpr-2026-orals-posters.json",
      "rank": 8,
      "selection_rationale": "Official CVPR 2026 highlight on efficient feed-forward dynamic 3D reconstruction from monocular videos with causal temporal attention, relevant even though the abstract does not foreground point maps.",
      "expected_use": "Source for feed-forward 4D reconstruction architecture, temporal attention, and dynamic/static disentanglement."
    },
    {
      "source_id": "cvpr2026-37041",
      "title": "MotionCrafter: Repurposing Video Generators for Dense Geometry and Motion Reconstruction",
      "url_or_path": "https://cvpr.thecvf.com/virtual/2026/poster/37041",
      "source_type": "paper",
      "venue_or_publisher": "CVPR 2026 Accept (Highlight)",
      "date": "2026",
      "discovery_method": "browser_rendered_dom+official_json",
      "official_confirmation_url": "https://cvpr.thecvf.com/static/virtual/data/cvpr-2026-orals-posters.json",
      "rank": 9,
      "selection_rationale": "Official CVPR 2026 highlight on monocular video 4D geometry and motion reconstruction using point maps and scene flows; relevant to video point-map reconstruction but less specifically online/streaming.",
      "expected_use": "Source for point-map and scene-flow latent representations in monocular video reconstruction."
    },
    {
      "source_id": "cvpr2026-39496",
      "title": "MoVieS: Motion-Aware 4D Dynamic View Synthesis in One Second",
      "url_or_path": "https://cvpr.thecvf.com/virtual/2026/poster/39496",
      "source_type": "paper",
      "venue_or_publisher": "CVPR 2026 Accept (Poster)",
      "date": "2026",
      "discovery_method": "browser_rendered_dom+official_json",
      "official_confirmation_url": "https://cvpr.thecvf.com/static/virtual/data/cvpr-2026-orals-posters.json",
      "rank": 10,
      "selection_rationale": "Official CVPR 2026 record on fast monocular-video 4D scene reconstruction, geometry, motion, and 3D point tracking; relevant for efficient reconstruction although framed as view synthesis.",
      "expected_use": "Source for fast dynamic reconstruction and unified geometry/motion/view-synthesis claims."
    },
    {
      "source_id": "cvpr2026-37570",
      "title": "ClipGStream: Clip-Stream Gaussian Splatting for Any Length and Any Motion Multi-View Dynamic Scene Reconstruction",
      "url_or_path": "https://cvpr.thecvf.com/virtual/2026/poster/37570",
      "source_type": "paper",
      "venue_or_publisher": "CVPR 2026 Accept (Poster)",
      "date": "2026",
      "discovery_method": "browser_rendered_dom+official_json",
      "official_confirmation_url": "https://cvpr.thecvf.com/static/virtual/data/cvpr-2026-orals-posters.json",
      "rank": 11,
      "selection_rationale": "Official CVPR 2026 record on clip-stream reconstruction for long dynamic multi-view videos; relevant to streamable reconstruction but based on Gaussian Splatting rather than point maps.",
      "expected_use": "Source for scalable long-sequence and clip-stream reconstruction design."
    },
    {
      "source_id": "cvpr2026-36695",
      "title": "MoRGS: Efficient Per-Gaussian Motion Reasoning for Streamable Dynamic 3D Scenes",
      "url_or_path": "https://cvpr.thecvf.com/virtual/2026/poster/36695",
      "source_type": "paper",
      "venue_or_publisher": "CVPR 2026 Accept (Poster)",
      "date": "2026",
      "discovery_method": "browser_rendered_dom+official_json",